{
  "id": "eng_vocabulary_word_ending_ill_b1",
  "category": "VOCABULARY",
  "subcategory": "Word Pattern > Words Ending in -ill",
  "difficulty": "B1",
  "targetAgeMin": 16,
  "targetAgeMax": 16,
  "targetAgeGroup": "teen",
  "tags": [
    "vocabulary",
    "word pattern",
    "spelling",
    "ill",
    "B1"
  ],
  "definition": {
    "name": "Words Ending in -ill",
    "description": "Many useful B1 words end in '-ill', such as skill, still, until, drill, and refill. Learning this spelling pattern helps students recognize word forms quickly, avoid missing one letter l, and use these words in study, daily routines, and instructions."
  },
  "examples": [
    {
      "english": "Writing clearly is an important skill for exams.",
      "translation": "清晰写作是考试中一项重要技能。",
      "note": "'Skill' is a common noun in school contexts."
    },
    {
      "english": "I still remember the key formula.",
      "translation": "我仍然记得那个关键公式。",
      "note": "'Still' often shows continuation."
    },
    {
      "english": "Please wait here until the teacher arrives.",
      "translation": "请在这里等到老师到来。",
      "note": "'Until' introduces a time limit."
    },
    {
      "english": "The coach asked us to do a grammar drill.",
      "translation": "老师让我们做一个语法训练。",
      "note": "'Drill' can mean focused practice."
    },
    {
      "english": "Refill your water bottle before class.",
      "translation": "上课前把你的水瓶再装满。",
      "note": "'Refill' is a practical verb in daily routines."
    },
    {
      "english": "The hill behind our school is very green in spring.",
      "translation": "学校后面的山丘在春天很绿。",
      "note": "'Hill' is a place noun and keeps the same -ill ending."
    }
  ],
  "expressions": [
    {
      "expression": "soft skill",
      "meaning": "a personal communication or teamwork ability",
      "register": "neutral",
      "scenario": "school"
    },
    {
      "expression": "hard skill",
      "meaning": "a technical and measurable ability",
      "register": "neutral",
      "scenario": "school"
    },
    {
      "expression": "still life",
      "meaning": "a painting of objects such as fruit or bottles",
      "register": "neutral",
      "scenario": "art class"
    },
    {
      "expression": "until now",
      "meaning": "up to the present time",
      "register": "neutral",
      "scenario": "writing"
    },
    {
      "expression": "fire drill",
      "meaning": "a school safety practice for emergencies",
      "register": "neutral",
      "scenario": "school"
    },
    {
      "expression": "free refill",
      "meaning": "you can get another drink at no extra cost",
      "register": "informal",
      "scenario": "daily conversation"
    }
  ],
  "relatedTopics": [
    "spelling chunks",
    "double consonants",
    "word families",
    "time connectors",
    "study and school vocabulary",
    "verb and noun usage",
    "proofreading"
  ],
  "source": null,
  "createdAt": "2026-08-07T00:00:00+09:00",
  "updatedAt": null
}
