{
  "id": "eng_grammar_modal_can_a2",
  "category": "GRAMMAR",
  "subcategory": "MODAL",
  "difficulty": "A2",
  "targetAgeMin": 12,
  "targetAgeMax": 18,
  "targetAgeGroup": "teen",
  "tags": [
    "can",
    "can't",
    "modal",
    "ability",
    "possibility",
    "grammar"
  ],
  "definition": {
    "name": "情态动词 can / can’t（能力与可能性）",
    "description": "can 表示能力、可能性或许可，否定形式为 can’t（cannot）。can 后接动词原形，不随主语变化。文中 You can only be what you are. 用 can 表达“只能、可能”的含义。"
  },
  "examples": [
    {
      "english": "You can only be what you are.",
      "translation": "你只能做你自己。",
      "note": "can 后接动词原形 be，表示可能性或能力。"
    },
    {
      "english": "But you can’t.",
      "translation": "但你做不到。",
      "note": "can't 是 can 的否定形式。"
    }
  ],
  "relatedTopics": [
    "eng_grammar_modal_could_a2"
  ],
  "source": "Zootopia.txt",
  "createdAt": "2026-08-14T09:00:00+09:00",
  "updatedAt": null
}
