{
  "id": "eng_grammar_place_in_inside_into_a2",
  "category": "GRAMMAR",
  "subcategory": "Preposition > Place and Movement",
  "difficulty": "A2",
  "targetAgeMin": 12,
  "targetAgeMax": 12,
  "targetAgeGroup": "teen",
  "tags": [
    "place prepositions",
    "movement prepositions",
    "in",
    "inside",
    "into",
    "grammar",
    "A2"
  ],
  "definition": {
    "name": "In, Inside, Into",
    "description": "Use 'in' and 'inside' to show position in an area or space. Use 'into' to show movement from outside to inside. 'Inside' gives extra focus on the inner part, while 'in' is the most common neutral choice."
  },
  "examples": [
    {
      "english": "The keys are in my bag.",
      "translation": "钥匙在我的包里。",
      "note": "Use 'in' for position inside a container."
    },
    {
      "english": "Please wait inside the room.",
      "translation": "请在房间里面等。",
      "note": "Use 'inside' to stress the inner part."
    },
    {
      "english": "The cat ran into the house.",
      "translation": "猫跑进了房子里。",
      "note": "Use 'into' for movement from outside to inside."
    },
    {
      "english": "There is a lot of water in the bottle.",
      "translation": "瓶子里有很多水。",
      "note": "State inside location with 'in'."
    },
    {
      "english": "Come inside. It is cold outside.",
      "translation": "进来吧，外面很冷。",
      "note": "Here 'inside' is used as an adverb (no noun after it)."
    },
    {
      "english": "She put her phone into her pocket.",
      "translation": "她把手机放进了口袋。",
      "note": "With verbs like 'put', use 'into' for direction."
    }
  ],
  "expressions": [
    {
      "expression": "in the box",
      "meaning": "located inside the box",
      "register": "neutral",
      "scenario": "daily conversation"
    },
    {
      "expression": "inside the building",
      "meaning": "in the inner part of the building",
      "register": "neutral",
      "scenario": "school"
    },
    {
      "expression": "go into the room",
      "meaning": "move from outside to the inside of the room",
      "register": "neutral",
      "scenario": "daily conversation"
    },
    {
      "expression": "jump into the pool",
      "meaning": "move into the pool",
      "register": "neutral",
      "scenario": "travel"
    },
    {
      "expression": "come inside",
      "meaning": "enter this place",
      "register": "neutral",
      "scenario": "daily conversation"
    },
    {
      "expression": "look inside",
      "meaning": "check the inner part",
      "register": "neutral",
      "scenario": "daily conversation"
    }
  ],
  "relatedTopics": [
    "place prepositions",
    "prepositions of movement",
    "in and into",
    "inside and outside",
    "put and take",
    "there is and there are",
    "verbs of movement"
  ],
  "source": null,
  "createdAt": "2026-08-07T00:00:00+09:00",
  "updatedAt": null
}
