{
  "id": "eng_grammar_place_in_inside_into_b1",
  "category": "GRAMMAR",
  "subcategory": "Preposition > Place and Movement",
  "difficulty": "B1",
  "targetAgeMin": 16,
  "targetAgeMax": 16,
  "targetAgeGroup": "teen",
  "tags": [
    "prepositions",
    "in",
    "inside",
    "into",
    "place",
    "movement",
    "B1"
  ],
  "definition": {
    "name": "In, Inside, Into",
    "description": "Use 'in' and 'inside' mainly for position, and 'into' mainly for movement or change. 'In' is the default word for being within an area, period, or situation. 'Inside' emphasizes the inner boundary or contrasts with outside. 'Into' shows direction from outside to inside, and at B1 it also often marks change (for example, change into, turn into)."
  },
  "examples": [
    {
      "english": "All the documents are in the folder.",
      "translation": "所有文件都在文件夹里。",
      "note": "'In' marks position within a container or system."
    },
    {
      "english": "We stayed inside the building during the storm.",
      "translation": "暴风雨期间我们待在楼内。",
      "note": "'Inside' highlights the boundary between inner and outer space."
    },
    {
      "english": "She walked into the lab without speaking.",
      "translation": "她一言不发地走进了实验室。",
      "note": "'Into' marks movement from outside to inside."
    },
    {
      "english": "He translated his notes into English.",
      "translation": "他把笔记翻译成了英语。",
      "note": "At B1, 'into' also expresses transformation or conversion."
    },
    {
      "english": "I keep my private thoughts inside my diary.",
      "translation": "我把私密想法写在日记里面。",
      "note": "'Inside' can add emotional emphasis on an inner space."
    },
    {
      "english": "She is in trouble after missing the deadline.",
      "translation": "错过截止日期后她陷入了麻烦。",
      "note": "'In' is common in abstract states: in trouble, in danger, in love."
    }
  ],
  "expressions": [
    {
      "expression": "in public",
      "meaning": "in a place where many people can see",
      "register": "neutral",
      "scenario": "daily conversation"
    },
    {
      "expression": "inside information",
      "meaning": "private information known by people within an organization",
      "register": "neutral",
      "scenario": "business"
    },
    {
      "expression": "look into a problem",
      "meaning": "investigate a problem",
      "register": "neutral",
      "scenario": "office"
    },
    {
      "expression": "turn into",
      "meaning": "change and become",
      "register": "neutral",
      "scenario": "writing"
    },
    {
      "expression": "break into",
      "meaning": "enter by force",
      "register": "neutral",
      "scenario": "news"
    },
    {
      "expression": "inside out",
      "meaning": "with the inner side on the outside; completely and deeply",
      "register": "informal",
      "scenario": "daily conversation"
    }
  ],
  "relatedTopics": [
    "prepositions of movement",
    "inside vs outdoors",
    "in vs within",
    "abstract state expressions with in",
    "change patterns with into",
    "phrasal verbs with into",
    "confusable prepositions: in, into, onto"
  ],
  "source": null,
  "createdAt": "2026-08-07T00:00:00+09:00",
  "updatedAt": null
}
